{
  "submission_id": "sub-0001",
  "job_id": "img-job-0001",
  "submitted_at": "2026-05-12T18:00:00Z",
  "source": "mock_fixture",
  "client": {
    "client_id": "client-001",
    "display_name": "Mock Client",
    "email": "client@example.test"
  },
  "client_brief": {
    "summary": "Add a black blender to the kitchen worktop near the wall socket.",
    "target_object": "black countertop blender",
    "desired_scene_change": "Place the blender on the left side of the worktop and make it look plugged in.",
    "constraints": ["Keep the kettle visible.", "Do not alter the window."],
    "protected_elements": ["window", "kettle"]
  },
  "assets": [
    {
      "asset_id": "asset-scene-001",
      "declared_role": "scene_image",
      "media_type": "image/jpeg",
      "uri": "mock://assets/kitchen-scene.jpg",
      "client_label": "Kitchen photo"
    },
    {
      "asset_id": "asset-object-001",
      "declared_role": "object_reference",
      "media_type": "image/png",
      "uri": "mock://assets/blender-reference.png",
      "client_label": "Blender reference"
    },
    {
      "asset_id": "asset-placement-001",
      "declared_role": "placement_sketch",
      "media_type": "image/png",
      "uri": "mock://assets/placement-sketch.png",
      "client_label": "Placement sketch"
    }
  ],
  "requested_mode": "mock"
}
